{
  "schema": "treatcode.intelligence.author-shard-plan.v3.1",
  "version": "3.1",
  "status": "development_assignment_plan",
  "task_count": 100,
  "shard_count": 20,
  "tasks_per_shard": 5,
  "contribution_file_pattern": "<shard_id>.json",
  "subject_model_families_excluded": [
    "gpt-5.6-luna",
    "gpt-5.6-sol"
  ],
  "category_mix": {
    "algorithm_and_data_structure": 15,
    "balanced_ternary_and_numeric": 10,
    "compiler_and_codegen": 15,
    "memory_and_pointer_safety": 10,
    "concurrency_and_state": 10,
    "syscall_and_abi": 10,
    "multi_module_repository_repair": 15,
    "build_test_and_tooling": 10,
    "performance_and_resource_constraints": 5
  },
  "track_mix": {
    "fresh_coding": 15,
    "repository_repair": 25,
    "terminal_agent": 15,
    "expert_reasoning": 15,
    "frontier_math": 10,
    "abstract_generalization": 10,
    "multimodal_reasoning": 5,
    "web_research": 5
  },
  "default_feature_minimums_per_shard": {
    "repository_exploration_required": 5,
    "multi_module_change": 4,
    "misleading_or_incomplete_tests": 2,
    "conflicting_invariants": 2,
    "initial_build_failure": 1,
    "abi_or_integration_bug": 1,
    "performance_constraint": 1
  },
  "feature_bonus_shards": {
    "initial_build_failure": ["V31-SHARD-001", "V31-SHARD-002", "V31-SHARD-003", "V31-SHARD-004", "V31-SHARD-005", "V31-SHARD-006", "V31-SHARD-007", "V31-SHARD-008", "V31-SHARD-009", "V31-SHARD-010"],
    "abi_or_integration_bug": ["V31-SHARD-006", "V31-SHARD-007", "V31-SHARD-008", "V31-SHARD-009", "V31-SHARD-010", "V31-SHARD-011", "V31-SHARD-012", "V31-SHARD-013", "V31-SHARD-014", "V31-SHARD-015"],
    "performance_constraint": ["V31-SHARD-016", "V31-SHARD-017", "V31-SHARD-018", "V31-SHARD-019", "V31-SHARD-020"]
  },
  "shards": [
    { "shard_id": "V31-SHARD-001", "first_task_number": 1, "categories": ["algorithm_and_data_structure", "balanced_ternary_and_numeric", "compiler_and_codegen", "memory_and_pointer_safety", "concurrency_and_state"], "tracks": ["fresh_coding", "repository_repair", "terminal_agent", "expert_reasoning", "frontier_math"] },
    { "shard_id": "V31-SHARD-002", "first_task_number": 6, "categories": ["syscall_and_abi", "multi_module_repository_repair", "build_test_and_tooling", "performance_and_resource_constraints", "algorithm_and_data_structure"], "tracks": ["fresh_coding", "repository_repair", "terminal_agent", "expert_reasoning", "abstract_generalization"] },
    { "shard_id": "V31-SHARD-003", "first_task_number": 11, "categories": ["balanced_ternary_and_numeric", "compiler_and_codegen", "memory_and_pointer_safety", "concurrency_and_state", "syscall_and_abi"], "tracks": ["fresh_coding", "repository_repair", "terminal_agent", "expert_reasoning", "frontier_math"] },
    { "shard_id": "V31-SHARD-004", "first_task_number": 16, "categories": ["multi_module_repository_repair", "build_test_and_tooling", "performance_and_resource_constraints", "algorithm_and_data_structure", "balanced_ternary_and_numeric"], "tracks": ["fresh_coding", "repository_repair", "terminal_agent", "expert_reasoning", "abstract_generalization"] },
    { "shard_id": "V31-SHARD-005", "first_task_number": 21, "categories": ["compiler_and_codegen", "memory_and_pointer_safety", "concurrency_and_state", "syscall_and_abi", "multi_module_repository_repair"], "tracks": ["fresh_coding", "repository_repair", "terminal_agent", "expert_reasoning", "frontier_math"] },
    { "shard_id": "V31-SHARD-006", "first_task_number": 26, "categories": ["build_test_and_tooling", "performance_and_resource_constraints", "algorithm_and_data_structure", "balanced_ternary_and_numeric", "compiler_and_codegen"], "tracks": ["fresh_coding", "repository_repair", "terminal_agent", "expert_reasoning", "abstract_generalization"] },
    { "shard_id": "V31-SHARD-007", "first_task_number": 31, "categories": ["memory_and_pointer_safety", "concurrency_and_state", "syscall_and_abi", "multi_module_repository_repair", "build_test_and_tooling"], "tracks": ["fresh_coding", "repository_repair", "terminal_agent", "expert_reasoning", "frontier_math"] },
    { "shard_id": "V31-SHARD-008", "first_task_number": 36, "categories": ["performance_and_resource_constraints", "algorithm_and_data_structure", "balanced_ternary_and_numeric", "compiler_and_codegen", "memory_and_pointer_safety"], "tracks": ["fresh_coding", "repository_repair", "terminal_agent", "expert_reasoning", "abstract_generalization"] },
    { "shard_id": "V31-SHARD-009", "first_task_number": 41, "categories": ["concurrency_and_state", "syscall_and_abi", "multi_module_repository_repair", "build_test_and_tooling", "performance_and_resource_constraints"], "tracks": ["fresh_coding", "repository_repair", "terminal_agent", "expert_reasoning", "frontier_math"] },
    { "shard_id": "V31-SHARD-010", "first_task_number": 46, "categories": ["algorithm_and_data_structure", "balanced_ternary_and_numeric", "compiler_and_codegen", "memory_and_pointer_safety", "concurrency_and_state"], "tracks": ["fresh_coding", "repository_repair", "terminal_agent", "expert_reasoning", "abstract_generalization"] },
    { "shard_id": "V31-SHARD-011", "first_task_number": 51, "categories": ["syscall_and_abi", "multi_module_repository_repair", "build_test_and_tooling", "algorithm_and_data_structure", "balanced_ternary_and_numeric"], "tracks": ["fresh_coding", "repository_repair", "terminal_agent", "expert_reasoning", "frontier_math"] },
    { "shard_id": "V31-SHARD-012", "first_task_number": 56, "categories": ["compiler_and_codegen", "memory_and_pointer_safety", "concurrency_and_state", "syscall_and_abi", "multi_module_repository_repair"], "tracks": ["fresh_coding", "repository_repair", "terminal_agent", "expert_reasoning", "frontier_math"] },
    { "shard_id": "V31-SHARD-013", "first_task_number": 61, "categories": ["build_test_and_tooling", "algorithm_and_data_structure", "balanced_ternary_and_numeric", "compiler_and_codegen", "memory_and_pointer_safety"], "tracks": ["fresh_coding", "repository_repair", "terminal_agent", "expert_reasoning", "frontier_math"] },
    { "shard_id": "V31-SHARD-014", "first_task_number": 66, "categories": ["concurrency_and_state", "syscall_and_abi", "multi_module_repository_repair", "build_test_and_tooling", "algorithm_and_data_structure"], "tracks": ["fresh_coding", "repository_repair", "terminal_agent", "expert_reasoning", "frontier_math"] },
    { "shard_id": "V31-SHARD-015", "first_task_number": 71, "categories": ["balanced_ternary_and_numeric", "compiler_and_codegen", "memory_and_pointer_safety", "concurrency_and_state", "syscall_and_abi"], "tracks": ["fresh_coding", "repository_repair", "terminal_agent", "expert_reasoning", "frontier_math"] },
    { "shard_id": "V31-SHARD-016", "first_task_number": 76, "categories": ["multi_module_repository_repair", "build_test_and_tooling", "algorithm_and_data_structure", "balanced_ternary_and_numeric", "compiler_and_codegen"], "tracks": ["repository_repair", "repository_repair", "abstract_generalization", "multimodal_reasoning", "web_research"] },
    { "shard_id": "V31-SHARD-017", "first_task_number": 81, "categories": ["memory_and_pointer_safety", "concurrency_and_state", "syscall_and_abi", "multi_module_repository_repair", "build_test_and_tooling"], "tracks": ["repository_repair", "repository_repair", "abstract_generalization", "multimodal_reasoning", "web_research"] },
    { "shard_id": "V31-SHARD-018", "first_task_number": 86, "categories": ["algorithm_and_data_structure", "compiler_and_codegen", "multi_module_repository_repair", "algorithm_and_data_structure", "compiler_and_codegen"], "tracks": ["repository_repair", "repository_repair", "abstract_generalization", "multimodal_reasoning", "web_research"] },
    { "shard_id": "V31-SHARD-019", "first_task_number": 91, "categories": ["multi_module_repository_repair", "algorithm_and_data_structure", "compiler_and_codegen", "multi_module_repository_repair", "algorithm_and_data_structure"], "tracks": ["repository_repair", "repository_repair", "abstract_generalization", "multimodal_reasoning", "web_research"] },
    { "shard_id": "V31-SHARD-020", "first_task_number": 96, "categories": ["compiler_and_codegen", "multi_module_repository_repair", "algorithm_and_data_structure", "compiler_and_codegen", "multi_module_repository_repair"], "tracks": ["repository_repair", "repository_repair", "abstract_generalization", "multimodal_reasoning", "web_research"] }
  ]
}
